<?xml version="1.0" encoding="UTF-8"?>
<!DOCTYPE config SYSTEM "gui_config.dtd">
<config>
	<phonebook>
		<entry name="Vladimir V. Putin" number="vovochka@kremlin.ru"/>
		<entry name="George W. Bush" number="george@whitehouse.gov"/>
		<entry name="Mickey Mouse" number="mickey@disneyland.com"/>
	</phonebook>
	<remote>
		<core host="192.168.0.1" port="7777"/>
		<gui host="192.168.0.1" port="8888"/>
	</remote>
</config>
